ID,NAME,AUTHOR,LINK,CITATION,ABSTRACT,DATE,TAGS
co-robotic-device-automated-tuning-emitters-enable-precision-irrigation,Co-Robotic Device for Automated Tuning of Emitters to Enable Precision Irrigation,joshua-viers;stefano-carpin,http://goldberg.berkeley.edu/pubs/case2016-DATE-precision-irrigation-submitted.pdf,"Co-Robotic Device for Automated Tuning of Emitters to Enable Precision Irrigation. David V. Gealy, Stephen McKinley, Menglong Guo, Lauren Miller, Stavros Vougioukas, Joshua Viers, Stefano Carpin, Ken Goldberg. IEEE International Conference on Automation Science and Engineering, (CASE), Dallas, TX. Aug 2016","Agriculture accounts for 85% of the world’s freshwater usage. Drip irrigation significantly reduces water usage and has been adopted by many farms, orchards, and vineyards. Rubber or PVC tubing is fitted with thousands of drip emitters whose water pressure and flow are controlled by a small number of valves resulting in suboptimal use of water resources. UAVs and other sensors are used to determine water needs and compute appropriate valve settings. As there are far more plants than valves, it is currently not possible to achieve ”precision irrigation”: adjusting flow at the individual plant level to compensate for variations in plant and soil properties, elevation, sun-angle, evapotranspiration, drainage, and emitter contamination by dirt or insects. As it is possible to retro-fit existing systems with low-cost, passive plastic screwadjustable emitters that are commercially available, this paper presents a design for an automated ”co-robotic” device that would allow such emitters to be systematically adjusted in the field to fine-tune water delivery at the plant level. This paper describes the mechatronic design, prototype, and initial experiments with a hand-held device designed with a coarseto-fine mechanism to facilitate alignment to passive emitters in the field and precise automated adjustment of flow settings. We report experiments with an implemented prototype that can compensate for orientation error up to ±39 degrees and position error up to ±42.5mm when adjusting a 16mm emitter cap",August 2016,
pulsed-flow-wave-attenuation-regulated-montane-river,Pulsed Flow Wave Attenuation on a Regulated Montane River,catherine-fong;sarah-m-yarnell;joshua-viers,http://onlinelibrary.wiley.com/doi/10.1002/rra.2925/full,"Fong, C. S., Yarnell, S. M., and Viers, J. H. (2016) Pulsed Flow Wave Attenuation on a Regulated Montane River. River Res. Applic., 32: 1047–1058. doi: 10.1002/rra.2925.","This study investigated the effects of hydrograph shape on attenuation of regulated pulsed flow events below a hydropower dam by categorizing and modelling the downstream movement of representative pulses on the upper Tuolumne River in the Sierra Nevadas of California, USA. We extracted underlying hydrograph shape patterns using principal component analysis on individual pulsed flow events released from 1988 to 2012 (n = 4439). From principal component loadings, six shape categories were determined: rectangular, front-step, back-step, goalpost, centred tower, and other. Attenuation of representative pulses from each shape type was then modelled using a one-dimensional hydraulic model of 42 river km. Model results demonstrated a durational threshold for representative pulses (~3–5 h) over which the degree of attenuation of ramping rates and peak discharge approached a limit. Simulations of front and back-step representative pulses showed trade-offs between attenuation of peak magnitudes and steepness of rising ramping rates. Reshaping pulses to reduce the adverse ecological effects of rapid changes in stage and velocity downstream was infeasible if the system was required to maintain current electricity production and recreational service levels.",July 2016,modeling;hydrology
missing-boat-freshwater-fish-conservation-california,Missing the Boat on Freshwater Fish Conservation in California,nick-santos;jeanette-howard;joshua-viers;peter-moyle,http://onlinelibrary.wiley.com/doi/10.1111/conl.12249/full,"Theodore E Grantham, Kurt A Fesenmyer, Ryan Peek, Eric Holmes, Rebecca M Quiñones, Andy Bell, Nick Santos, Jeanette K Howard, Joshua H Viers, Peter B Moyle. Missing the Boat on Freshwater Fish Conservation in California. Conservation Letters 10 (1), 77-85","Population growth and increasing water-use pressures threaten California's freshwater ecosystems and have led many native fishes to the brink of extinction. To guide fish conservation efforts, we provide the first systematic prioritization of river catchments and identify those that disproportionately contribute to fish taxonomic diversity. Using high-resolution range maps of exceptional quality, we also assess the representation of fish taxa within the state's protected areas and examine the concordance of high-priority catchments with existing reserves and among distinct taxonomic groups. Although most of the state's native fishes are found within protected areas, only a small proportion of their ranges are represented. Few high-priority catchments occur within protected areas, suggesting that fish conservation will require active management and targeted river restoration outside of reserves. These results provide the foundation for systematic freshwater conservation planning in California and for prioritizing where limited resources are allocated for fish recovery and protection.",July 2016,habitat-restoration;biodiversity
management-spring-snowmelt-recession-regulated-systems,Management of the Spring Snowmelt Recession in Regulated Systems,sarah-m-yarnell;ryan-a-peek;gerhard-epke,http://onlinelibrary.wiley.com/doi/10.1111/1752-1688.12424/full,"Yarnell, Sarah, Ryan Peek, Gerhard Epke, and Amy Lind, 2016. Management of the Spring Snowmelt Recession in Regulated Systems. Journal of the American Water Resources Association (JAWRA) 52(3):723–736. DOI: 10.1111/1752-1688.12424","In an effort to restore predictable ecologically relevant spring snowmelt recession flow patterns in rivers regulated by dams, this study defined a methodology by which spring flow regimes can be modeled in regulated systems from the quantifiable characteristics of spring snowmelt recessions in unregulated rivers. An analysis of eight unregulated rivers across the Sierra Nevada mountain range in California found that unregulated systems behaved similarly with respect to seasonal spring patterns and recession limb curvature, and thus prescribed flows could be designed in a manner that mimics those predictable characteristics. Using the methodology to quantify spring recession flows in terms of a daily percent decrease in flow, a series of flow recession scenarios were created for application in an existing hydrodynamic model for the regulated Rubicon River. The modeling results showed that flow recessions with slow ramping rates similar to those observed in unregulated rivers (less than 10% per day) were likely to be protective of native aquatic species, such as the Foothill yellow-legged frog, while flows that receded at greater rates would likely result in desiccation of egg masses and potential stranding of tadpoles and fry. Furthermore, recession rates of less than 10% per day provided the most spatially diverse hydraulic habitat in the modeled domain for an appropriate duration in spring to support all native species guilds and maximize aquatic biodiversity.",June 2016,environmental-flows;modeling
valuing-year-go-hydrologic-forecast-improvements-peaking-hydropower-system-sierra-nevada,Valuing year-to-go hydrologic forecast improvements for a peaking hydropower system in the Sierra Nevada Authors,david-rheinheimer;roger-bales;jay-lund;joshua-viers,http://onlinelibrary.wiley.com/doi/10.1002/2015WR018295/full,"Rheinheimer, D. E., R. C. Bales, C. A. Oroza, J. R. Lund, and J. H. Viers (2016), Valuing year-to-go hydrologic forecast improvements for a peaking hydropower system in the Sierra Nevada, Water Resour. Res., 52, 3815–3828, doi:10.1002/2015WR018295.","We assessed the potential value of hydrologic forecasting improvements for a snow-dominated high-elevation hydropower system in the Sierra Nevada of California, using a hydropower optimization model. To mimic different forecasting skill levels for inflow time series, rest-of-year inflows from regression-based forecasts were blended in different proportions with representative inflows from a spatially distributed hydrologic model. The statistical approach mimics the simpler, historical forecasting approach that is still widely used. Revenue was calculated using historical electricity prices, with perfect price foresight assumed. With current infrastructure and operations, perfect hydrologic forecasts increased annual hydropower revenue by $0.14 to $1.6 million, with lower values in dry years and higher values in wet years, or about $0.8 million (1.2%) on average, representing overall willingness-to-pay for perfect information. A second sensitivity analysis found a wider range of annual revenue gain or loss using different skill levels in snow measurement in the regression-based forecast, mimicking expected declines in skill as the climate warms and historical snow measurements no longer represent current conditions. The value of perfect forecasts was insensitive to storage capacity for small and large reservoirs, relative to average inflow, and modestly sensitive to storage capacity with medium (current) reservoir storage. The value of forecasts was highly sensitive to powerhouse capacity, particularly for the range of capacities in the northern Sierra Nevada. The approach can be extended to multireservoir, multipurpose systems to help guide investments in forecasting.",May 2016,hydropower
fire-frequency-severity-relationship-and-legacy-fire-suppression-california-forests,The fire frequency-severity relationship and the legacy of fire suppression in California forests,zachary-steel;hugh-safford;joshua-viers,http://www.esajournals.org/doi/abs/10.1890/ES14-00224.1,"Steel, ZL, HD Safford, JH Viers. 2015. The fire frequency-severity relationship and the legacy of fire suppression in California forests. Ecosphere 6:art8. http://dx.doi.org/10.1890/ES14-00224.1","Fire is one of the most important natural disturbance processes in the western United States and ecosystems differ markedly with respect to their ecological and evolutionary relationships with fire. Reference fire regimes in forested ecosystems can be categorized along a gradient ranging from “fuel-limited” to “climate-limited” where the former types are often characterized by frequent, lower-severity wildfires and the latter by infrequent, more severe wildfires. Using spatial data on fire severity from 1984–2011 and metrics related to fire frequency, we tested how divergence from historic (pre-Euroamerican settlement) fire frequencies due to a century of fire suppression influences rates of high-severity fire in five forest types in California. With some variation among bioregions, our results suggest that fires in forest types characterized by fuel-limited fire regimes (e.g., yellow pine and mixed conifer forest) tend to burn with greater proportions of high-severity fire as either time since last fire or the mean modern fire return interval (FRI) increases. Two intermediate fire regime types (mixed evergreen and bigcone Douglas-fir) showed a similar relationship between fire frequency and fire severity. However, red fir and redwood forests, which are characterized by more climate-limited fire regimes, did not show significant positive relationships between FRI and fire severity. This analysis provides strong evidence that for fuel-limited fire regimes, lack of fire leads to increasing rates of high-severity burning. Our study also substantiates the general validity of “fuel-limited” vs. “climate-limited” explanations of differing patterns of fire effects and response in forest types of the western US.",January 2015,climate-change;forest-fire
managing-freshwater-river-wetland-and-estuarine-protected-areas,"Managing freshwater, river, wetland and estuarine protected areas",joshua-viers,https://scholar.google.com/citations?view_op=view_citation&hl=en&user=hDRoPd4AAAAJ&sortby=pubdate&citation_for_view=hDRoPd4AAAAJ%3AZEcFV8kAgqMC,"Protected Area Governance and Management, Edition: 1, Chapter: 19, Publisher: ANU Press, Editors: G. L. Worboys, M. Lockwood, A. Kothari, S. Feary I. Pulsford, pp.569–608",,January 2015,
it-restoration-or-reconciliation-californias-experience-restoring-sacramento-san-joaquin,Is it restoration or reconciliation? California's experience restoring the Sacramento - San Joaquin River Delta provides lessons learned and pathways forward to sustain critical ecosystem functions and services in a highly managed riverine delta.,josh-viers;rodd-kelsey,http://adsabs.harvard.edu/abs/2014AGUFMPA21A..02V,"Viers, JH, R Kelsey. 2014. Is it restoration or reconciliation? California's experience restoring the Sacramento - San Joaquin River Delta provides lessons learned and pathways forward to sustain critical ecosystem functions and services in a highly managed riverine delta. Poster session at the American Geophysical Union Fall Meeting, San Francisco, CA. PA21A-02","Reconciling the needs of nature and people in California's Sacramento - San Joaquin River Delta represents one of the most critical ecosystem management imperatives in western North America. Over 150 years the Delta has been managed for near-term human benefits and in the process 95% of riverine and deltaic wetlands have been lost throughout the region. Despite extensive land conversion and alteration of hydrological and physical processes, the Delta remains important habitat for migratory birds and is home to over 60% of California's native fish species. It is also the waterwheel for the state's vast water distribution network and is maintained by a system of constructed levees that are at risk from catastrophic failure due to sea level rise, floods, and/or seismic activity. Such a collapse would have dire consequences for > 25M humans and world's 10th largest economy that depend on its freshwater. Thus, the ultimate cost of this ecosystem alteration and simplification is a riverscape that is no longer reliable for nature or people. For 30 years, attempts to 'restore' Delta ecosystems and improve reliability have met with mixed results. For example, reconnection of floodplains to floodwaters has resulted in improved ecological health for native fishes and recharge to localized aquifers. Uncoordinated releases of discharges below dams, however, have resulted in diminished water quality and populations of indicator species. Attempts to create wildlife friendly farms have been countered by an increase in perennial agriculture and commensurate increases in irrigation water demand. From these lessons learned, we demonstrate three key components of a reconciled Delta that will be necessary in the future: 1) full restoration of critical habitats, reconnecting land and water to rebuild ecosystem function; 2) landscape redesign, incorporating natural and engineered infrastructure to create a biologically diverse, resilient landscape to support both agriculture and natural ecosystems, while reducing the impacts of climate change; and 3) recognition that some ecosystem components, including less resilient species, may be lost and other novel components may emerge. These findings serve to reconcile conflicting demands and restoring ecosystem functions in highly altered wetland landscapes worldwide.",December 2014,habitat-restoration;invasive-species
assessing-ecosystem-services-and-multifunctionality-vineyard-systems,Assessing the Value of Improved Hydrologic Forecasting for Hydropower in the Sierra Nevada at Multiple Spatial Scales,kimberly-nicholas;joshua-viers,https://www.frontiersin.org/articles/10.3389/fenvs.2017.00015/full,"Winkler Klara J., Viers Joshua H., Nicholas Kimberly A. 2017. Assessing Ecosystem Services and Multifunctionality for Vineyard Systems. Frontiers in Environmental Science,5: 15. doi: 10.3389/fenvs.2017.00015","Vineyards shape important economic, cultural, and ecological systems in many temperate biomes. Like other agricultural systems, they can be multifunctional landscapes that not only produce grapes, but also for example serve as wildlife habitat, sequester carbon, and are places of rich traditions. However, research and management practices often focus mostly on individual, specific ecosystem services, without considering multifunctionality. Therefore, we set out to meet four research objectives: (1) evaluate how frequently the ecosystem services approach has been applied in vineyard systems; (2) identify which individual ecosystem services have been most frequently studied in vineyard systems, (3) summarize knowledge on the key ecosystem services identified in (2), and (4) illustrate approaches to multifunctionality in vineyards to inform more holistic land management. For research objective (1), we identified 45 publications that used the term “ecosystem services” in relation to vineyards, but found that only seven fully apply the ecosystem service concept to their research. For research objective (2), we operationalized the Common International Classification of Ecosystem Services (CICES) for 27 ecosystem services in vineyards, in order to consider provisioning, regulating, and cultural services through an analysis of more than 4,000 scientific papers that mentioned individual services. We found the six most frequently studied ecosystem services included (1) cultivated crops, (2) filtration, sequestration, storage and accumulation by the vineyards, (3) pest control and (4) disease control, (5) heritage, cultural and (6) scientific services. For research objective (3), we found that research on these six single ecosystem services is highly developed, but relationships between single ecosystem services are less studied. Therefore, we suggest that greater adoption of the ecosystem services approach could help scientists and practitioners to acknowledge the multifunctionality of the agricultural system and gain a holistic perspective that supports more sustainable land management.",April 2017,biodiversity;agriculture;management;vinecology
functional-flows-modified-riverscapes-hydrographs-habitats-and-opportunities,"Functional Flows in Modified Riverscapes: Hydrographs, Habitats and Opportunities",sarah-m-yarnell;alison-whipple;erin-beller;clifford-dahm;chris-enright;peter-goodwin;geoff-petts;joshua-viers,http://adsabs.harvard.edu/abs/2014AGUFMEP41C..06Y,"Yarnell, SM, AA Whipple, E Beller, C Dahm, C Enright, P Goodwin, G Petts, JH Viers. 2014. Functional Flows in Modified Riverscapes: Hydrographs, Habitats and Opportunities. Poster session at the American Geophysical Union Fall Meeting, San Francisco, CA. EP41C-06","Building on previous environmental flow discussions and a growing recognition that geomorphic and ecological processes are inherent to river functionality and biodiversity, we propose a functional flows approach to managing rivers in contemporary modified riverscapes. The approach focuses on retaining specific functional flows or process-based components of the hydrograph in managed systems, including: peak magnitude flows, recession (seasonal transition) flows, dry season low flows, wet season initiation flows, and interannual variability based on climate. Using a series of case studies and specific examples, we illustrate the importance of each key functional flow. In order to maximize the functionality of these flows and thereby maximize aquatic diversity, restoration of channel-floodplain connectivity and sediment transport processes must be enhanced in both space and time. We further provide considerations for managers that include five guiding principles for developing a functional flows approach or incorporating functional flows into existing environmental flow frameworks. We suggest this approach allows for the development of flow regimes that encompass ecosystem processes alongside varied human needs and can be applied in an adaptive management framework allowing for adjustment in non-stationary river environments.",December 2014,modeling;hydrology
preliminary-optimization-spring-run-chinook-salmon-environmental-flows-lassen-foothill,Preliminary Optimization for Spring-Run Chinook Salmon Environmental Flows in Lassen Foothill Watersheds,jenny-ta;rodd-kelsey;jeanette-howard;maurice-hall;jay-lund;joshua-viers,http://adsabs.harvard.edu/abs/2014AGUFM.H11G0955T,"Ta, J, R Kelsey, J Howard, M Hall, J Lund, JH Viers. 2014. Preliminary Optimization for Spring-Run Chinook Salmon Environmental Flows in Lassen Foothill Watersheds. Poster session at the American Geophysical Union Fall Meeting, San Francisco, CA. H11G-0955","Stream flow controls physical and ecological processes in rivers that support freshwater ecosystems and biodiversity vital for services that humans depend on. This master variable has been impaired by human activities like dam operations, water diversions, and flood control infrastructure. Furthermore, increasing water scarcity due to rising water demands and droughts has further stressed these systems, calling for the need to find better ways to identify and allocate environmental flows. In this study, a linear optimization model was developed for environmental flows in river systems that have minimal or no regulation from dam operations, but still exhibit altered flow regimes due to surface water diversions and groundwater abstraction. Flow regime requirements for California Central Valley spring-run Chinook salmon (Oncorhynchus tshawytscha) life history were used as a test case to examine how alterations to the timing and magnitude of water diversions meet environmental flow objectives while minimizing impact to local water supply. The model was then applied to Mill Creek, a tributary of the Sacramento River, in northern California, and its altered flow regime that currently impacts adult spring-run Chinook spawning and migration. The resulting optimized water diversion schedule can be used to inform water management decisions that aim to maximize benefit for the environment while meeting local water demands.",December 2014,modeling;management;hydrology;salmon
Characterizing Past and Future Flood Regimes of California's Cosumnes River: A Hydroinformatic Approach
Systematic Screening of Dams for Environmental Flow Assessment and Implementation
100 years of California’s water rights system: patterns, trends and uncertainty
Agriculture’s Contribution to Nitrate Contamination of Californian Groundwater (1945–2005)
Simulating High-Elevation Hydropower with Regional Climate Warming in the West Slope, Sierra Nevada
A programmable information system for management and analysis of aquatic species range data in California
Combined Effects of Reservoir Operations and Climate Warming on the Flow Regime of Hydropower Bypass Reaches of California's Sierra Nevada
Hydrolapse Videography: A Coupled Hydroinformatic Stack For Improved Visual Assessment Of River Dynamics
Modern departures in fire severity and area vary by forest type, Sierra Nevada and southern Cascades, California, USA
Evaluation of Water Rights to Reveal Hidden Patterns and Trends in Water Resources Management
Incorporating Climate Change in Flow Regime Alteration Studies in Hydropower Licensing
Using high resolution subsurface modeling in managed aquifer recharge
Characterization of pulsed flow attenuation on a regulated montane river
Quantifying the Restorable Water Volume of California's Sierra Nevada Meadows
A Method to Consider Whether Dams Mitigate Climate Change Effects on Stream Temperatures
Vinecology: pairing wine with nature
In bad waters: Water year classification in nonstationary climates
Hydroclimatic alteration increases vulnerability of montane meadows in the Sierra Nevada, California
Modeling Economic Impacts of Environmental Flows in California's Yuba River Watershed
Using Topography to Meet Wildlife and Fuels Treatment Objectives in Fire-Suppressed Landscapes
Tropical dry forest trees and the relationship between local abundance and geographic range
Characterization of the Unregulated Spring Snowmelt Recession in the Sierra Nevada, California, and Potential Changes with Regional Climate Warming
Conceptual ecosystem model of sub-Arctic river response to climate change: Kobuk River, Alaska
tree-detection-and-delineation-cosumnes-river-preserve,Tree detection and delineation of the cosumnes river preserve,sohail-shafti;bernd-hamann;rachel-hutchinson;oliver-kreylos;josh-viers,http://www.science.mcmaster.ca/~igu-cmgs/publications/geocomputation/Shafi_et_al.pdf," Shafii, S, B Hamman, RA Hutchinson, O Kreylos, JH Viers. 2009. Tree Detection and Delineation of the Cosumnes River Preserve. Geocomputation 2009, Canberra, Australia.",,November 2009,LIDAR
